{"caseId":"case-run-f2d521df7adc46089fd291a8ae6327d4","casePackRef":"release-readiness@1.0.0","checkRunCount":19,"factCount":7,"failedCaseIds":[],"finalScore":100,"hardGatesPassed":true,"mcpServer":"rogueskills-cases","mode":"verified_replay","recommendation":"blocked","replayCaseId":"case-run-c13f4265126a4e2ca3eb58b5b61b61f3","runtimeVerified":true,"sourceCount":4,"status":"succeeded"}